{
  "$schema": "https://json-schema.org/draft/2020-12/schema",
  "$id": "https://extension.js.org/schemas/distribution/publish-manifest-1.0.json",
  "title": "Extension.dev Publish / Distribution Manifest",
  "description": "The descriptor for a published build: what artifacts exist, their signing/installability per browser engine, and where the shareable URL serves them. THE CROSS-REPO SEAM: produced by extension.js (`extension publish`), consumed by the extension.dev platform (hosts the artifacts at <workspaceSlug>.extension.dev/<projectSlug>/<sha7>/<browser>.<ext>), wrapped by @extension.dev/mcp (`extension_publish`, auth-gated). Called the 'publish descriptor' in prose to avoid confusion with the extension's own manifest.json. Note: `extension build` emits unsigned per-browser ZIPs (plugin-compilation/zip.ts); signing (Firefox .xpi via AMO, store submission) is a later platform step that UPGRADES this descriptor in place.",
  "type": "object",
  "additionalProperties": false,
  "required": ["v", "publishedAt", "source", "artifacts", "distribution"],
  "properties": {
    "v": {"const": 1, "description": "Schema version. Bump via $id + this field together."},
    "publishedAt": {"type": "string", "format": "date-time"},
    "source": {
      "type": "object",
      "additionalProperties": false,
      "required": ["projectName", "projectVersion", "cliVersion"],
      "description": "Provenance — pins the build to a CLI + project (mirrors docs/readiness meta).",
      "properties": {
        "projectName": {"type": "string", "description": "From the extension manifest `name`."},
        "projectVersion": {"type": "string", "description": "From the extension manifest `version`."},
        "cliVersion": {"type": "string", "description": "Resolved `extension` package version that built the artifacts."},
        "cliCommit": {"type": "string", "pattern": "^[0-9a-f]{7,40}$", "description": "Optional source SHA."},
        "manifestVersion": {"enum": [2, 3], "description": "MV of the published build."}
      }
    },
    "artifacts": {
      "type": "array",
      "minItems": 1,
      "description": "One entry per built browser target.",
      "items": {"$ref": "#/$defs/artifact"}
    },
    "distribution": {
      "type": "object",
      "additionalProperties": false,
      "required": ["url", "visibility"],
      "description": "Where the artifacts are reachable. Hosted by the extension.dev platform.",
      "properties": {
        "url": {
          "type": "string",
          "format": "uri",
          "description": "The shareable base URL for this build. Pattern (confirmed in www.extension.dev): https://<workspaceSlug>.extension.dev/<projectSlug>/<sha7>, where <sha7> is the 7-char short build SHA (the canonical build identity — no separate deployment id). Each browser artifact is a file under this base, named <browser>.<ext> (see artifact.downloadUrl)."
        },
        "visibility": {"enum": ["public", "unlisted", "private"], "description": "unlisted = link-only (not indexed). private = requires an extension.dev session."},
        "expiresAt": {"type": ["string", "null"], "format": "date-time", "description": "null = no expiry."}
      }
    }
  },
  "$defs": {
    "artifact": {
      "type": "object",
      "additionalProperties": false,
      "required": ["browser", "file", "ext", "bytes", "sha256", "signing", "installability"],
      "properties": {
        "browser": {"enum": ["chrome", "edge", "chromium-based", "firefox", "gecko-based", "safari"]},
        "file": {"type": "string", "description": "Filename as served, e.g. my-extension-1.0.0.zip or my-extension-1.0.0.xpi."},
        "ext": {
          "enum": [".zip", ".xpi", ".crx"],
          "description": "Default from `extension build` is .zip for every engine (unsigned). .xpi appears only after AMO signing; .crx only after CWS keypair signing."
        },
        "bytes": {"type": "integer", "minimum": 0},
        "sha256": {"type": "string", "pattern": "^[0-9a-f]{64}$", "description": "Integrity digest the platform serves + the descriptor pins (mirrors templates-meta.json integrity)."},
        "downloadUrl": {"type": "string", "format": "uri", "description": "Canonical per-browser artifact URL = distribution.url + /<browser>.<ext>, e.g. https://<workspaceSlug>.extension.dev/<projectSlug>/<sha7>/chrome.zip or .../firefox.xpi. This is the file a user downloads for this engine."},
        "signing": {
          "type": "object",
          "additionalProperties": false,
          "required": ["state"],
          "description": "Signing state. This — not the extension — decides whether a normal user can install from the URL.",
          "properties": {
            "state": {
              "enum": ["unsigned", "store-signed"],
              "description": "unsigned = raw build zip (what `extension build` emits). store-signed = signed by the store authority (AMO for Firefox; CWS for Chrome). There is no meaningful self-signed tier for modern engines."
            },
            "authority": {"enum": ["amo", "cws", "edge", "none"], "default": "none"},
            "submissionId": {"type": "string", "description": "Store/AMO submission id when signing went through @extension.dev/deploy."}
          }
        },
        "installability": {
          "enum": [
            "chromium-unpacked",
            "chromium-store-only",
            "firefox-temporary",
            "firefox-signed",
            "store-listed",
            "safari-convert-required"
          ],
          "description": "The HONEST install class for this artifact: chromium-unpacked = zip, load-unpacked, dev/tester only. chromium-store-only = normal users must install from the Web Store (off-store .crx is blocked). firefox-temporary = unsigned, loads only via about:debugging / Developer Edition. firefox-signed = AMO-signed .xpi, installable directly from the URL (TRUE self-distribution). store-listed = the URL points at a published store listing. safari-convert-required = needs Xcode conversion (see safari build target)."
        },
        "install": {
          "type": "object",
          "additionalProperties": false,
          "description": "Rendered guidance for this artifact's install class.",
          "properties": {
            "summary": {"type": "string", "description": "One-line, e.g. 'Installable directly in Firefox' or 'Load unpacked (developers/testers only)'."},
            "steps": {"type": "array", "items": {"type": "string"}},
            "docsUrl": {"type": "string", "format": "uri"}
          }
        }
      }
    }
  }
}
