{
  "v": 1,
  "publishedAt": "2026-05-26T22:40:00.000Z",
  "source": {
    "projectName": "My Extension",
    "projectVersion": "1.0.0",
    "cliVersion": "3.13.5",
    "cliCommit": "672c4f28",
    "manifestVersion": 3
  },
  "artifacts": [
    {
      "browser": "chrome",
      "file": "my-extension-1.0.0.zip",
      "ext": ".zip",
      "bytes": 184320,
      "sha256": "9f86d081884c7d659a2feaa0c55ad015a3bf4f1b2b0b822cd15d6c15b0f00a08",
      "downloadUrl": "https://cezaraugusto.extension.dev/my-extension/672c4f2/chrome.zip",
      "signing": {"state": "unsigned", "authority": "none"},
      "installability": "chromium-unpacked",
      "install": {
        "summary": "Load unpacked (developers/testers only)",
        "steps": [
          "Download and unzip the file",
          "Open chrome://extensions and enable Developer mode",
          "Click 'Load unpacked' and select the unzipped folder"
        ],
        "docsUrl": "https://extension.js.org/docs/install/chrome-unpacked"
      }
    },
    {
      "browser": "firefox",
      "file": "my-extension-1.0.0.xpi",
      "ext": ".xpi",
      "bytes": 191002,
      "sha256": "2c26b46b68ffc68ff99b453c1d30413413422d706483bfa0f98a5e886266e7ae",
      "downloadUrl": "https://cezaraugusto.extension.dev/my-extension/672c4f2/firefox.xpi",
      "signing": {"state": "store-signed", "authority": "amo", "submissionId": "amo-7781234"},
      "installability": "firefox-signed",
      "install": {
        "summary": "Installable directly in Firefox",
        "steps": ["Open the URL in Firefox", "Click Install when prompted"],
        "docsUrl": "https://extension.js.org/docs/install/firefox-xpi"
      }
    }
  ],
  "distribution": {
    "url": "https://cezaraugusto.extension.dev/my-extension/672c4f2",
    "visibility": "unlisted",
    "expiresAt": null
  }
}
